{
  "object": "order",
  "id": "ord_test_example",
  "event_id": "evt_test_washington_konpa",
  "quantity": 2,
  "total": 99,
  "currency": "USD",
  "status": "test",
  "sub_id": "click-42",
  "checkout_url": "https://timtim.live/partners/demo#checkout-ord_test_example",
  "expires_at": "2026-10-07T12:30:00.000Z",
  "created_at": "2026-10-07T12:00:00.000Z",
  "test": true
}
